{
  "extraction_provenance": {
    "generator": "provider.brainfm",
    "generator_version": "1.1.0",
    "sensitive_url_policy": "omit_all_provider_urls_and_tokens"
  },
  "match": {
    "matching_occurrence_count": 2,
    "strategy": "exact_variation_filename",
    "unique_canonical_record_count": 1
  },
  "provider": "brain.fm",
  "provider_lifecycle": {
    "created_at": "2026-07-13T14:28:42.337Z",
    "has_multiple_neural_effect_levels": true,
    "release_status": "published"
  },
  "provider_measurements": {
    "beats_per_minute": 88,
    "brightness_level": 0.42,
    "complexity_level": 0.39,
    "declared_duration_seconds": 1800,
    "neural_effect_level": 0.47
  },
  "provider_metadata_schema_version": "1.1.0",
  "provider_track": {
    "filename": "Bifocals_Focus_Learning_Lofi_30_88BPM_MediumNEL_Nrmlzd2_VBR5.mp3",
    "title": "Bifocals",
    "track_id": "6a54f61a6ff4d00262502495",
    "variation_id": "6a54f61a6ff4d00262502499"
  },
  "recording": {
    "filename": "Bifocals_Focus_Learning_Lofi_30_88BPM_MediumNEL_Nrmlzd2_VBR5.mp3",
    "hash_algorithm": "sha256",
    "sha256": "5e001c19dd334a68da0c0602a0bc491f3fd87cb115bea0cfe6b1afd09fee690a",
    "size_bytes": 25788996
  },
  "source_capture": {
    "filename": "focus_learning_20260915.har",
    "format": "har_json_responses",
    "hash_algorithm": "sha256",
    "json_document_count": 93,
    "sha256": "2547f936816cde2fb6fee28d75f30795008657ccf753b4e221b93fc49f3f62ce"
  },
  "taxonomy": {
    "activity": null,
    "all_provider_tags": {
      "activity": [
        "Learning"
      ],
      "genre": [
        "Lofi"
      ],
      "instrument": [
        "Acoustic Drum set",
        "Arp Synth",
        "Electric Bass",
        "Electric Keys",
        "Organic Percussion",
        "Processed Strings",
        "Processed Vocals",
        "Synth Pad"
      ],
      "mood": [
        "Brooding",
        "Chill",
        "Dark",
        "Mysterious"
      ],
      "release": [
        "July 13 2026"
      ],
      "subgenre": [
        "Funk",
        "Hip-Hop",
        "Lo-Fi"
      ]
    },
    "genres": [
      "Lofi"
    ],
    "instruments": [
      "Acoustic Drum set",
      "Arp Synth",
      "Electric Bass",
      "Electric Keys",
      "Organic Percussion",
      "Processed Strings",
      "Processed Vocals",
      "Synth Pad"
    ],
    "mental_state": "Focus",
    "mobile_activity": null,
    "moods": [
      "Brooding",
      "Chill",
      "Dark",
      "Mysterious"
    ],
    "release_tags": [
      "July 13 2026"
    ],
    "style": "normal",
    "subgenres": [
      "Funk",
      "Hip-Hop",
      "Lo-Fi"
    ],
    "web_activity": "Learning"
  }
}
