{
  "extraction_provenance": {
    "generator": "provider.brainfm",
    "generator_version": "1.0.0",
    "sensitive_url_policy": "omit_all_provider_urls_and_tokens"
  },
  "match": {
    "matching_occurrence_count": 3,
    "strategy": "exact_variation_filename",
    "unique_canonical_record_count": 1
  },
  "provider": "brain.fm",
  "provider_lifecycle": {
    "created_at": "2022-06-22T21:05:15.363Z",
    "has_multiple_neural_effect_levels": false,
    "release_status": "published"
  },
  "provider_measurements": {
    "beats_per_minute": 120,
    "brightness_level": 0.23,
    "complexity_level": 0.35,
    "declared_duration_seconds": 1800,
    "neural_effect_level": 0.66
  },
  "provider_metadata_schema_version": "1.0.0",
  "provider_track": {
    "filename": "High Tide Atmospheric Focus 11 Conor_1.2_Nrmlzd2_VBR5.mp3",
    "title": "High Tide",
    "track_id": "62b3840b59241178fdf4fa87",
    "variation_id": "62b3840b5924118c8df4fa89"
  },
  "recording": {
    "filename": "High Tide Atmospheric Focus 11 Conor_1.2_Nrmlzd2_VBR5.mp3",
    "hash_algorithm": "sha256",
    "sha256": "d3c1f9b9299c4ba2bf02d67ad9c939fb6d9580f464135b9c2f8bb6cf6922d425",
    "size_bytes": 21540112
  },
  "source_capture": {
    "filename": "High Tide Atmospheric Focus 11 Conor_1.2_Nrmlzd2_VBR5.json",
    "format": "concatenated_json",
    "hash_algorithm": "sha256",
    "json_document_count": 3,
    "sha256": "d04f3c0bcfffed94101335e7b35872a411f7736ebefa497354c7bea638699357"
  },
  "taxonomy": {
    "activity": "Study & Read",
    "all_provider_tags": {
      "activity": [
        "Learning",
        "Study & Read"
      ],
      "genre": [
        "Atmospheric"
      ],
      "instrument": [
        "Textural Soundscape"
      ],
      "mood": [
        "Calm",
        "Chill",
        "Dreamlike",
        "Floating",
        "Serene"
      ],
      "release": [
        "Desktop Import",
        "Mobile Import"
      ],
      "subgenre": [
        "Ambient"
      ]
    },
    "genres": [
      "Atmospheric"
    ],
    "instruments": [
      "Textural Soundscape"
    ],
    "mental_state": "Focus",
    "moods": [
      "Calm",
      "Chill",
      "Dreamlike",
      "Floating",
      "Serene"
    ],
    "release_tags": [
      "Desktop Import",
      "Mobile Import"
    ],
    "style": "normal",
    "subgenres": [
      "Ambient"
    ]
  }
}
