{
  "extraction_provenance": {
    "generator": "provider.brainfm",
    "generator_version": "1.0.0",
    "sensitive_url_policy": "omit_all_provider_urls_and_tokens"
  },
  "match": {
    "matching_occurrence_count": 2,
    "strategy": "exact_variation_filename",
    "unique_canonical_record_count": 1
  },
  "provider": "brain.fm",
  "provider_lifecycle": {
    "created_at": "2022-06-22T21:19:41.013Z",
    "has_multiple_neural_effect_levels": false,
    "release_status": "published"
  },
  "provider_measurements": {
    "beats_per_minute": 120,
    "brightness_level": 0.67,
    "complexity_level": 0.54,
    "declared_duration_seconds": 1800,
    "neural_effect_level": 0.67
  },
  "provider_metadata_schema_version": "1.0.0",
  "provider_track": {
    "filename": "Black and White Chris Recharge Session 4_1.9_Nrmlzd2_30mins_VBR5.mp3",
    "title": "Black and White",
    "track_id": "62b3876d592411869af51932",
    "variation_id": "62b3876d5924113de0f51934"
  },
  "recording": {
    "filename": "Black and White Chris Recharge Session 4_1.9_Nrmlzd2_30mins_VBR5.mp3",
    "hash_algorithm": "sha256",
    "sha256": "fff74b19c3e22f2bf2cc1622e632b5b873d7a695a7aef85f8bd7b4052420bcbc",
    "size_bytes": 28853568
  },
  "source_capture": {
    "filename": "recharge_20260914.har",
    "format": "har_json_responses",
    "hash_algorithm": "sha256",
    "json_document_count": 60,
    "sha256": "b602ee05c1ee0119cf65cb5aff035270164bf91ae48011cc11e7fbb297b1d0b1"
  },
  "taxonomy": {
    "activity": "Recharge",
    "all_provider_tags": {
      "activity": [
        "Recharge",
        "Unwind"
      ],
      "genre": [
        "Electronic"
      ],
      "instrument": [
        "Acoustic Piano",
        "Rain Ambience"
      ],
      "mood": [
        "Calm",
        "Dreamlike",
        "Floating",
        "Hopeful",
        "Meditative",
        "Optimistic",
        "Playful"
      ],
      "release": [
        "Desktop Import",
        "Mobile Import"
      ],
      "subgenre": [
        "Acoustic",
        "Ambient"
      ]
    },
    "genres": [
      "Electronic"
    ],
    "instruments": [
      "Acoustic Piano",
      "Rain Ambience"
    ],
    "mental_state": "Relax",
    "moods": [
      "Calm",
      "Dreamlike",
      "Floating",
      "Hopeful",
      "Meditative",
      "Optimistic",
      "Playful"
    ],
    "release_tags": [
      "Desktop Import",
      "Mobile Import"
    ],
    "style": "normal",
    "subgenres": [
      "Acoustic",
      "Ambient"
    ]
  }
}
