{
  "extraction_provenance": {
    "generator": "provider.brainfm",
    "generator_version": "1.0.0",
    "sensitive_url_policy": "omit_all_provider_urls_and_tokens"
  },
  "match": {
    "matching_occurrence_count": 1,
    "strategy": "exact_variation_filename",
    "unique_canonical_record_count": 1
  },
  "provider": "brain.fm",
  "provider_lifecycle": {
    "created_at": "2022-11-02T16:04:34.744Z",
    "has_multiple_neural_effect_levels": false,
    "release_status": "published"
  },
  "provider_measurements": {
    "beats_per_minute": 120,
    "brightness_level": 0.36,
    "complexity_level": 0.47,
    "declared_duration_seconds": 900,
    "neural_effect_level": 0.63
  },
  "provider_metadata_schema_version": "1.0.0",
  "provider_track": {
    "filename": "GoldenBirds_Relax_Chill_Atmospheric_15_120bpm_Nrmlzd2_VBR5.mp3",
    "title": "Golden Birds",
    "track_id": "63629512a9fdb36a3b3d2818",
    "variation_id": "63629512a9fdb3703f3d281a"
  },
  "recording": {
    "filename": "GoldenBirds_Relax_Chill_Atmospheric_15_120bpm_Nrmlzd2_VBR5.mp3",
    "hash_algorithm": "sha256",
    "sha256": "f0e09611b144dae37d244a3eeb22fa2648eea687a691a76e0ce9ba9001a6d838",
    "size_bytes": 12588278
  },
  "source_capture": {
    "filename": "chill_20260914.har",
    "format": "har_json_responses",
    "hash_algorithm": "sha256",
    "json_document_count": 88,
    "sha256": "e61817baf819e994f66542863b4ebe04de666c485963109fe0333c146cb12461"
  },
  "taxonomy": {
    "activity": "Chill",
    "all_provider_tags": {
      "activity": [
        "Chill"
      ],
      "genre": [
        "Atmospheric"
      ],
      "instrument": [
        "Processed Strings",
        "Textural Soundscape"
      ],
      "mood": [
        "Calm",
        "Chill",
        "Dreamlike",
        "Floating",
        "Hopeful",
        "Meditative",
        "Serene"
      ],
      "release": [
        "November 2 2022"
      ],
      "subgenre": [
        "Ambient"
      ]
    },
    "genres": [
      "Atmospheric"
    ],
    "instruments": [
      "Processed Strings",
      "Textural Soundscape"
    ],
    "mental_state": "Relax",
    "moods": [
      "Calm",
      "Chill",
      "Dreamlike",
      "Floating",
      "Hopeful",
      "Meditative",
      "Serene"
    ],
    "release_tags": [
      "November 2 2022"
    ],
    "style": "normal",
    "subgenres": [
      "Ambient"
    ]
  }
}
