{
  "extraction_provenance": {
    "generator": "provider.brainfm",
    "generator_version": "1.0.0",
    "sensitive_url_policy": "omit_all_provider_urls_and_tokens"
  },
  "match": {
    "matching_occurrence_count": 1,
    "strategy": "exact_variation_filename",
    "unique_canonical_record_count": 1
  },
  "provider": "brain.fm",
  "provider_lifecycle": {
    "created_at": "2022-06-22T21:38:37.505Z",
    "has_multiple_neural_effect_levels": false,
    "release_status": "published"
  },
  "provider_measurements": {
    "beats_per_minute": 120,
    "brightness_level": 0,
    "complexity_level": 0.79,
    "declared_duration_seconds": 900,
    "neural_effect_level": 0.48
  },
  "provider_metadata_schema_version": "1.0.0",
  "provider_track": {
    "filename": "Relax-WarmDrones1.4-FixedStupidBug-Nrmlzd_15mins_VBR5.mp3",
    "title": "New Beginning",
    "track_id": "62b38bdd5924119faff55003",
    "variation_id": "62b3958a592411ca23f57375"
  },
  "recording": {
    "filename": "Relax-WarmDrones1.4-FixedStupidBug-Nrmlzd_15mins_VBR5.mp3",
    "hash_algorithm": "sha256",
    "sha256": "fdef148c5289980e893ebbf7306fd412bef82c51ce02f4ca95027a52b3252d65",
    "size_bytes": 8911096
  },
  "source_capture": {
    "filename": "recharge_20260914.har",
    "format": "har_json_responses",
    "hash_algorithm": "sha256",
    "json_document_count": 60,
    "sha256": "b602ee05c1ee0119cf65cb5aff035270164bf91ae48011cc11e7fbb297b1d0b1"
  },
  "taxonomy": {
    "activity": "Recharge",
    "all_provider_tags": {
      "activity": [
        "Recharge"
      ],
      "genre": [
        "Atmospheric"
      ],
      "instrument": [
        "Textural Soundscape"
      ],
      "mood": [
        "Calm",
        "Chill",
        "Dreamlike",
        "Floating",
        "Mysterious"
      ],
      "release": [
        "Desktop Import",
        "Mobile Import"
      ],
      "subgenre": [
        "Ambient"
      ]
    },
    "genres": [
      "Atmospheric"
    ],
    "instruments": [
      "Textural Soundscape"
    ],
    "mental_state": "Relax",
    "moods": [
      "Calm",
      "Chill",
      "Dreamlike",
      "Floating",
      "Mysterious"
    ],
    "release_tags": [
      "Desktop Import",
      "Mobile Import"
    ],
    "style": "normal",
    "subgenres": [
      "Ambient"
    ]
  }
}
