{
  "extraction_provenance": {
    "generator": "provider.brainfm",
    "generator_version": "1.1.0",
    "sensitive_url_policy": "omit_all_provider_urls_and_tokens"
  },
  "match": {
    "matching_occurrence_count": 13,
    "strategy": "exact_variation_filename",
    "unique_canonical_record_count": 1
  },
  "provider": "brain.fm",
  "provider_lifecycle": {
    "created_at": "2022-07-29T17:41:24.068Z",
    "has_multiple_neural_effect_levels": false,
    "release_status": "published"
  },
  "provider_measurements": {
    "beats_per_minute": 120,
    "brightness_level": 0.2,
    "complexity_level": 0.01,
    "declared_duration_seconds": 3600,
    "neural_effect_level": 0.95
  },
  "provider_metadata_schema_version": "1.1.0",
  "provider_track": {
    "filename": "Dark Moon_Sleep_DeepSleep_Atmospheric_60_120bpm_Nrmlzd2_VBR5.mp3",
    "title": "Dark Moon",
    "track_id": "62e41bc48aeb53bddfab3b4f",
    "variation_id": "62e41bc48aeb53c315ab3b51"
  },
  "recording": {
    "filename": "Dark Moon_Sleep_DeepSleep_Atmospheric_60_120bpm_Nrmlzd2_VBR5.mp3",
    "hash_algorithm": "sha256",
    "sha256": "b760fbd22f6612d7d6e6c91885238f702d64ba6c4e818af64809dc8a98d1af57",
    "size_bytes": 46222700
  },
  "source_capture": {
    "filename": "sleep_guided_sleep_20260915.har",
    "format": "har_json_responses",
    "hash_algorithm": "sha256",
    "json_document_count": 164,
    "sha256": "a5ae5e4bcc76b1eaddd2bb093f07a772e938678158ebdea5daaca676d30b669d"
  },
  "taxonomy": {
    "activity": "Deep Sleep",
    "all_provider_tags": {
      "activity": [
        "Deep Sleep"
      ],
      "genre": [
        "Atmospheric"
      ],
      "instrument": [
        "Textural Soundscape"
      ],
      "mood": [
        "Calm",
        "Chill",
        "Dreamlike",
        "Floating",
        "Meditative",
        "Serene"
      ],
      "release": [
        "July 29 2022"
      ],
      "subgenre": [
        "Ambient"
      ]
    },
    "genres": [
      "Atmospheric"
    ],
    "instruments": [
      "Textural Soundscape"
    ],
    "mental_state": "Sleep",
    "mobile_activity": "Deep Sleep",
    "moods": [
      "Calm",
      "Chill",
      "Dreamlike",
      "Floating",
      "Meditative",
      "Serene"
    ],
    "release_tags": [
      "July 29 2022"
    ],
    "style": "normal",
    "subgenres": [
      "Ambient"
    ],
    "web_activity": "Deep Sleep"
  }
}
