{
  "extraction_provenance": {
    "generator": "provider.brainfm",
    "generator_version": "1.1.0",
    "sensitive_url_policy": "omit_all_provider_urls_and_tokens"
  },
  "match": {
    "matching_occurrence_count": 1,
    "strategy": "exact_variation_filename",
    "unique_canonical_record_count": 1
  },
  "provider": "brain.fm",
  "provider_lifecycle": {
    "created_at": "2024-07-12T20:01:03.051Z",
    "has_multiple_neural_effect_levels": false,
    "release_status": "published"
  },
  "provider_measurements": {
    "beats_per_minute": 120,
    "brightness_level": 0.48,
    "complexity_level": 0.05,
    "declared_duration_seconds": 900,
    "neural_effect_level": 0.9
  },
  "provider_metadata_schema_version": "1.1.0",
  "provider_track": {
    "filename": "Cloud Dream Unguided Meditation Session 3_1.1_Nrmlzd2 1_15mins_VBR5.mp3",
    "title": "Cloud Dream",
    "track_id": "66918b7fde19d0f1c74ea73b",
    "variation_id": "66918b7fde19d0f1c74ea73d"
  },
  "recording": {
    "filename": "Cloud Dream Unguided Meditation Session 3_1.1_Nrmlzd2 1_15mins_VBR5.mp3",
    "hash_algorithm": "sha256",
    "sha256": "569882c4a52fe93ad21352f8eab8b8b2e11ed7b40f85d3b75fd61d9bede10bb3",
    "size_bytes": 11544326
  },
  "source_capture": {
    "filename": "meditate_unguided_20260915.har",
    "format": "har_json_responses",
    "hash_algorithm": "sha256",
    "json_document_count": 58,
    "sha256": "6870cf90cc1ccc7d02ece9a2960531e7a2ce54130c890b6b310175e1caa434ab"
  },
  "taxonomy": {
    "activity": "Unguided",
    "all_provider_tags": {
      "activity": [
        "Unguided"
      ],
      "genre": [
        "Atmospheric"
      ],
      "instrument": [
        "Acoustic Piano",
        "Chimes/Bells"
      ],
      "mood": [
        "Calm",
        "Floating",
        "Meditative"
      ],
      "release": [
        "July 15 2024"
      ],
      "subgenre": [
        "Ambient"
      ]
    },
    "genres": [
      "Atmospheric"
    ],
    "instruments": [
      "Acoustic Piano",
      "Chimes/Bells"
    ],
    "mental_state": "Meditate",
    "mobile_activity": "Unguided",
    "moods": [
      "Calm",
      "Floating",
      "Meditative"
    ],
    "release_tags": [
      "July 15 2024"
    ],
    "style": "normal",
    "subgenres": [
      "Ambient"
    ],
    "web_activity": null
  }
}
