{
  "extraction_provenance": {
    "generator": "provider.brainfm",
    "generator_version": "1.1.0",
    "sensitive_url_policy": "omit_all_provider_urls_and_tokens"
  },
  "match": {
    "matching_occurrence_count": 1,
    "strategy": "exact_variation_filename",
    "unique_canonical_record_count": 1
  },
  "provider": "brain.fm",
  "provider_lifecycle": {
    "created_at": "2023-12-18T15:29:18.953Z",
    "has_multiple_neural_effect_levels": true,
    "release_status": "published"
  },
  "provider_measurements": {
    "beats_per_minute": 120,
    "brightness_level": 0.3,
    "complexity_level": 0.22,
    "declared_duration_seconds": 6812,
    "neural_effect_level": 0.54
  },
  "provider_metadata_schema_version": "1.1.0",
  "provider_track": {
    "filename": "Multiverse_Focus_DeepWork_Atmospheric_30_120bpm_MedNEL_Nrmlzd2_expanded_VBR5.mp3",
    "title": "Multiverse",
    "track_id": "6580654ec08ad58656f22b65",
    "variation_id": "6580654fc08ad514c0f22b69"
  },
  "recording": {
    "filename": "Multiverse_Focus_DeepWork_Atmospheric_30_120bpm_MedNEL_Nrmlzd2_expanded_VBR5.mp3",
    "hash_algorithm": "sha256",
    "sha256": "5f2141aa591f1dbebac2908e437a9517ace137d5459d5c459293bf42355f2fb1",
    "size_bytes": 97152248
  },
  "source_capture": {
    "filename": "sleep_sleep_and_wake_20261019.har",
    "format": "har_json_responses",
    "hash_algorithm": "sha256",
    "json_document_count": 67,
    "sha256": "e8bff5a37e3c9c5bd3a20a4c776b8903a43f67b6702eeb4cc26c68386aedb09a"
  },
  "taxonomy": {
    "activity": "Deep Work",
    "all_provider_tags": {
      "activity": [
        "Deep Work"
      ],
      "genre": [
        "Atmospheric"
      ],
      "instrument": [
        "Textural Soundscape"
      ],
      "mood": [
        "Calm",
        "Dreamlike",
        "Floating",
        "Meditative",
        "Ponderous",
        "Serene"
      ],
      "release": [
        "December 18 2023"
      ],
      "subgenre": [
        "Ambient"
      ]
    },
    "genres": [
      "Atmospheric"
    ],
    "instruments": [
      "Textural Soundscape"
    ],
    "mental_state": "Focus",
    "mobile_activity": "Deep Work",
    "moods": [
      "Calm",
      "Dreamlike",
      "Floating",
      "Meditative",
      "Ponderous",
      "Serene"
    ],
    "release_tags": [
      "December 18 2023"
    ],
    "style": "normal",
    "subgenres": [
      "Ambient"
    ],
    "web_activity": "Deep Work"
  }
}
