{
  "extraction_provenance": {
    "generator": "provider.brainfm",
    "generator_version": "1.0.0",
    "sensitive_url_policy": "omit_all_provider_urls_and_tokens"
  },
  "match": {
    "matching_occurrence_count": 1,
    "strategy": "exact_variation_filename",
    "unique_canonical_record_count": 1
  },
  "provider": "brain.fm",
  "provider_lifecycle": {
    "created_at": "2024-03-22T15:53:57.638Z",
    "has_multiple_neural_effect_levels": true,
    "release_status": "published"
  },
  "provider_measurements": {
    "beats_per_minute": 120,
    "brightness_level": 0.27,
    "complexity_level": 0.31,
    "declared_duration_seconds": 900,
    "neural_effect_level": 0.72
  },
  "provider_metadata_schema_version": "1.0.0",
  "provider_track": {
    "filename": "AbundantRegions_Relax_Recharge_Atmospheric_15_120bpm_HighNEL_Nrmlzd2_VBR5.mp3",
    "title": "Abundant Regions",
    "track_id": "65fda995cc7d1e000a587510",
    "variation_id": "65fda995cc7d1e000a587512"
  },
  "recording": {
    "filename": "AbundantRegions_Relax_Recharge_Atmospheric_15_120bpm_HighNEL_Nrmlzd2_VBR5.mp3",
    "hash_algorithm": "sha256",
    "sha256": "39373427c761e37c682d959c4891b72c0c30c750566837ab299a64c590882e19",
    "size_bytes": 11291451
  },
  "source_capture": {
    "filename": "AbundantRegions_Relax_Recharge_Atmospheric_15_120bpm_HighNEL_Nrmlzd2_VBR5",
    "format": "json",
    "hash_algorithm": "sha256",
    "json_document_count": 1,
    "sha256": "be0deecec0843a3702aab4cf7dbbe8bb39e1e8948dbe86b322a06a7a7f6b82d9"
  },
  "taxonomy": {
    "activity": "Chill",
    "all_provider_tags": {
      "activity": [
        "Chill",
        "Recharge",
        "Unwind"
      ],
      "genre": [
        "Atmospheric"
      ],
      "instrument": [
        "Processed Strings",
        "Synth Bass",
        "Textural Soundscape"
      ],
      "mood": [
        "Calm",
        "Chill",
        "Dreamlike",
        "Floating",
        "Meditative",
        "Serene"
      ],
      "release": [
        "March 25 2024"
      ],
      "subgenre": [
        "Ambient"
      ]
    },
    "genres": [
      "Atmospheric"
    ],
    "instruments": [
      "Processed Strings",
      "Synth Bass",
      "Textural Soundscape"
    ],
    "mental_state": "Relax",
    "moods": [
      "Calm",
      "Chill",
      "Dreamlike",
      "Floating",
      "Meditative",
      "Serene"
    ],
    "release_tags": [
      "March 25 2024"
    ],
    "style": "normal",
    "subgenres": [
      "Ambient"
    ]
  }
}
