{
  "extraction_provenance": {
    "generator": "provider.brainfm",
    "generator_version": "1.1.0",
    "sensitive_url_policy": "omit_all_provider_urls_and_tokens"
  },
  "match": {
    "matching_occurrence_count": 3,
    "strategy": "exact_variation_filename",
    "unique_canonical_record_count": 1
  },
  "provider": "brain.fm",
  "provider_lifecycle": {
    "created_at": "2025-12-01T16:07:49.514Z",
    "has_multiple_neural_effect_levels": true,
    "release_status": "published"
  },
  "provider_measurements": {
    "beats_per_minute": 120,
    "brightness_level": 0.29,
    "complexity_level": 0.02,
    "declared_duration_seconds": 3600,
    "neural_effect_level": 0.34
  },
  "provider_metadata_schema_version": "1.1.0",
  "provider_track": {
    "filename": "AShortPause_Sleep_DeepSleep_60_120bpm_MedNEL_Nrmlzd2_VBR5.mp3",
    "title": "A Short Pause",
    "track_id": "692dbd55b8f361da92eb9d96",
    "variation_id": "692dbd55b8f361da92eb9d9a"
  },
  "recording": {
    "filename": "AShortPause_Sleep_DeepSleep_60_120bpm_MedNEL_Nrmlzd2_VBR5.mp3",
    "hash_algorithm": "sha256",
    "sha256": "5d2ac20a8ba1b10a03860d185b6f91d18fb4f2e90423f7e2711a1dbfed419ad8",
    "size_bytes": 50543136
  },
  "source_capture": {
    "filename": "sleep_sleep_and_wake_20261019.har",
    "format": "har_json_responses",
    "hash_algorithm": "sha256",
    "json_document_count": 67,
    "sha256": "e8bff5a37e3c9c5bd3a20a4c776b8903a43f67b6702eeb4cc26c68386aedb09a"
  },
  "taxonomy": {
    "activity": "Deep Sleep",
    "all_provider_tags": {
      "activity": [
        "Deep Sleep"
      ],
      "genre": [
        "Atmospheric"
      ],
      "instrument": [
        "Synth Bass",
        "Synth Pad",
        "Textural Soundscape"
      ],
      "mood": [
        "Calm",
        "Chill",
        "Dreamlike",
        "Floating",
        "Serene"
      ],
      "release": [
        "December 1 2025"
      ],
      "subgenre": [
        "Ambient"
      ]
    },
    "genres": [
      "Atmospheric"
    ],
    "instruments": [
      "Synth Bass",
      "Synth Pad",
      "Textural Soundscape"
    ],
    "mental_state": "Sleep",
    "mobile_activity": "Deep Sleep",
    "moods": [
      "Calm",
      "Chill",
      "Dreamlike",
      "Floating",
      "Serene"
    ],
    "release_tags": [
      "December 1 2025"
    ],
    "style": "normal",
    "subgenres": [
      "Ambient"
    ],
    "web_activity": "Deep Sleep"
  }
}
