{
  "extraction_provenance": {
    "generator": "provider.brainfm",
    "generator_version": "1.1.0",
    "sensitive_url_policy": "omit_all_provider_urls_and_tokens"
  },
  "match": {
    "matching_occurrence_count": 1,
    "strategy": "exact_variation_filename",
    "unique_canonical_record_count": 1
  },
  "provider": "brain.fm",
  "provider_lifecycle": {
    "created_at": "2025-09-08T18:42:39.107Z",
    "has_multiple_neural_effect_levels": true,
    "release_status": "published"
  },
  "provider_measurements": {
    "beats_per_minute": 90,
    "brightness_level": 0.45,
    "complexity_level": 0.22,
    "declared_duration_seconds": 1800,
    "neural_effect_level": 0.37
  },
  "provider_metadata_schema_version": "1.1.0",
  "provider_track": {
    "filename": "StarHopping_Focus_Creativity_Lofi_30_90BPM_MediumNELNrmlzd2_VBR5.mp3",
    "title": "Star Hopping",
    "track_id": "68bf239f95e372361f91f160",
    "variation_id": "68bf239f95e372361f91f164"
  },
  "recording": {
    "filename": "StarHopping_Focus_Creativity_Lofi_30_90BPM_MediumNELNrmlzd2_VBR5.mp3",
    "hash_algorithm": "sha256",
    "sha256": "51e91e678c429b29498e532a476a62861a1e6225bb0af4664404a927ed949687",
    "size_bytes": 29110895
  },
  "source_capture": {
    "filename": "focus_creativity_20260915.har",
    "format": "har_json_responses",
    "hash_algorithm": "sha256",
    "json_document_count": 55,
    "sha256": "6fbfed0f27d38beb228c00ed932c03712878fdfd17b7987cd16cda3bf57e0543"
  },
  "taxonomy": {
    "activity": null,
    "all_provider_tags": {
      "activity": [
        "Creativity"
      ],
      "genre": [
        "Lofi"
      ],
      "instrument": [
        "Acoustic Bass",
        "Acoustic Drumset",
        "Acoustic Piano",
        "Mallets",
        "Textural Soundscape"
      ],
      "mood": [
        "Hopeful",
        "Meditative",
        "Serene",
        "Strong"
      ],
      "release": [
        "September 8 2025"
      ],
      "subgenre": [
        "Hip-Hop",
        "Jazz",
        "Lo-Fi"
      ]
    },
    "genres": [
      "Lofi"
    ],
    "instruments": [
      "Acoustic Bass",
      "Acoustic Drumset",
      "Acoustic Piano",
      "Mallets",
      "Textural Soundscape"
    ],
    "mental_state": "Focus",
    "mobile_activity": null,
    "moods": [
      "Hopeful",
      "Meditative",
      "Serene",
      "Strong"
    ],
    "release_tags": [
      "September 8 2025"
    ],
    "style": "normal",
    "subgenres": [
      "Hip-Hop",
      "Jazz",
      "Lo-Fi"
    ],
    "web_activity": "Creativity"
  }
}
